Name,Description,Abbreviation,ContractServiceLevelCode,DeletionStateCode,BillingFrequencyCode,AllotmentTypeCode,UseDiscountAsPercentage,EffectivityCalendar,CreatedOn,ModifiedOn
Mountain Bike Service,Contract template for typical mountain bike service contracts,M_Ser,1,0,2,2,FALSE,++++++++++++++++++++++++++++++++++++++++++++++++++++++++++++++++++++++++++++++++++++++++++++++++++++++++++++++++++++++++++++++++++++++++++++++++++++++++++++++++++++++++,8/30/2007,8/30/2007
Long Term Service,Contract template for long term service contracts,L_Ser,1,0,5,1,FALSE,--------++++++++----------------++++++++----------------++++++++----------------++++++++----------------++++++++--------------------------------------------------------,8/30/2007,8/30/2007
Derailleur Service,Contract template for derailleur service jobs,D_Ser,1,0,1,3,FALSE,--------++++++++----------------------------------------++++++++--------------------------------------------------------------------------------------------------------,8/30/2007,8/30/2007
Short Term Service,Contract template for short term service contracts (spanning 1-6 months),S_Ser,1,0,1,2,TRUE,--------++++++++----------------++++++++----------------++++++++----------------++++++++----------------++++++++--------------------------------------------------------,8/30/2007,8/30/2007
Bike Service By Case,Template for Bike Service by number of cases,AWC Svc Temp 1,2,0,1,1,TRUE,--------+++++++++---------------+++++++++---------------+++++++++---------------+++++++++---------------+++++++++-------------------------------------------------------,8/30/2007,8/30/2007
Bike Service By Date,Template for Bike Service by coverage dates,AWC Svc Temp 2,3,0,1,3,TRUE,--------+++++++++---------------+++++++++---------------+++++++++---------------+++++++++---------------+++++++++-------------------------------------------------------,8/30/2007,8/30/2007
